<?xml version="1.0"?>

<DataProviders
  xmlns="xervice:dataprovider-01"
  xmlns:xsi="http://www.w3.org/2001/XMLSchema-instance"
  xsi:schemaLocation="xervice:dataprovider-01 http://static.xervice.online/schema/dataprovider.schema.xsd"
>

    <DataProvider name="TestKeyValue">
        <DataElement name="Key" type="string"/>
        <DataElement name="value" type="string" allownull="true"/>
        <DataElement name="default" type="string" default="Test"/>
        <DataElement name="IsActive" type="bool" default="false"/>
    </DataProvider>

    <DataProvider name="TestKeyValueCollection">
        <DataElement name="keyValues" singleton="OneValue" type="TestKeyValue[]"/>
        <DataElement name="ChildValue" singleton="ChildValue" allownull="true" type="TestKeyValue"/>
    </DataProvider>
</DataProviders>